{
  "schema_version": "market-impact.regime-study-registration.v1",
  "version": "a-share-representative-regime-study-v1",
  "dataset_id": "market-regime-dataset-5c7e9826138ad0cb8f68f0e2d3c48fed2118712ad5b0d3bf94dc5483e801eca7",
  "dataset_hash": "5c7e9826138ad0cb8f68f0e2d3c48fed2118712ad5b0d3bf94dc5483e801eca7",
  "method_catalog_id": "method-skill-catalog-f438e45a7ef80c751da4a6817e9de6c837f73ba901642510ffb2d23ee8218a8d",
  "method_catalog_hash": "f438e45a7ef80c751da4a6817e9de6c837f73ba901642510ffb2d23ee8218a8d",
  "outcomes_opened": true,
  "source_catalog": [
    {
      "source_id": "tushare-market",
      "category": "market_price",
      "provider_id": "tushare-http",
      "source_tier": "regulated",
      "acquisition_mode": "implemented_source_publication_model",
      "point_in_time_authority": true,
      "evidence_types": ["price_or_market_context", "valuation_or_price"],
      "license_note": "Private token-backed index history; each checkpoint binds the exact as-of rows and a conservative next-day availability rule. This authenticates modeled availability, not an original provider vintage."
    },
    {
      "source_id": "tushare-industry",
      "category": "industry_price",
      "provider_id": "tushare-http",
      "source_tier": "regulated",
      "acquisition_mode": "implemented_source_publication_model",
      "point_in_time_authority": true,
      "evidence_types": ["price_or_market_context"],
      "license_note": "Private SW2021 index history; each checkpoint binds all 31 series and the same conservative next-day availability rule. Licensed rows are never committed."
    },
    {
      "source_id": "csrc-official-archive",
      "category": "official_context",
      "provider_id": "csrc-web-archive",
      "source_tier": "official",
      "acquisition_mode": "implemented_authenticated_archive",
      "point_in_time_authority": true,
      "evidence_types": ["new_evidence", "fundamental_feedback"],
      "license_note": "Source-specific CSRC HTML extraction binds a conservative source-reported publication time to a verified immutable archive hash; payloads remain private."
    },
    {
      "source_id": "state-council-official-archive",
      "category": "official_context",
      "provider_id": "gov-cn-web-archive",
      "source_tier": "official",
      "acquisition_mode": "implemented_authenticated_archive",
      "point_in_time_authority": true,
      "evidence_types": ["new_evidence", "fundamental_feedback"],
      "license_note": "State Council English HTML extraction binds the exact source Updated time to a verified immutable archive hash; payloads remain private."
    },
    {
      "source_id": "exchange-official-archive",
      "category": "official_context",
      "provider_id": "sse-szse-web-archive",
      "source_tier": "regulated",
      "acquisition_mode": "planned_archive_capture",
      "point_in_time_authority": false,
      "evidence_types": ["new_evidence", "fundamental_feedback"],
      "license_note": "Bind notices, rule versions, and market-closure publications."
    },
    {
      "source_id": "pbc-macro-vintage",
      "category": "macro_vintage",
      "provider_id": "pbc-release-archive",
      "source_tier": "official",
      "acquisition_mode": "planned_archive_capture",
      "point_in_time_authority": false,
      "evidence_types": ["reference_class", "new_evidence"],
      "license_note": "Bind monetary-policy reports and release vintages, not today-only values."
    },
    {
      "source_id": "nbs-macro-vintage",
      "category": "macro_vintage",
      "provider_id": "nbs-release-archive",
      "source_tier": "official",
      "acquisition_mode": "implemented_authenticated_archive",
      "point_in_time_authority": true,
      "evidence_types": ["reference_class", "new_evidence"],
      "license_note": "Source-specific NBS HTML extraction binds exact PubDate times to digest-verified historical replays; payloads remain private and later revisions require separate lineage."
    },
    {
      "source_id": "bloomberg-licensed-news",
      "category": "established_news",
      "provider_id": "bloomberg-licensed-adapter",
      "source_tier": "established_news",
      "acquisition_mode": "planned_entitlement_required",
      "point_in_time_authority": false,
      "evidence_types": ["timestamped_narrative_corpus", "new_evidence"],
      "license_note": "Metadata and hashes only unless the user's entitlement permits local private storage; never commit content."
    },
    {
      "source_id": "reuters-licensed-news",
      "category": "established_news",
      "provider_id": "reuters-licensed-adapter",
      "source_tier": "established_news",
      "acquisition_mode": "planned_entitlement_required",
      "point_in_time_authority": false,
      "evidence_types": ["timestamped_narrative_corpus", "new_evidence"],
      "license_note": "Metadata and hashes only unless licensed; preserve publisher timestamps and versions."
    },
    {
      "source_id": "xinhua-established-news",
      "category": "established_news",
      "provider_id": "publisher-https-snapshot",
      "source_tier": "established_news",
      "acquisition_mode": "implemented_source_reported_version",
      "point_in_time_authority": true,
      "evidence_types": ["timestamped_narrative_corpus", "new_evidence"],
      "license_note": "Exact publisher timestamp and body digest; only metadata is committed and the research copy remains private."
    },
    {
      "source_id": "scmp-established-news",
      "category": "established_news",
      "provider_id": "publisher-https-snapshot",
      "source_tier": "established_news",
      "acquisition_mode": "implemented_source_reported_version",
      "point_in_time_authority": true,
      "evidence_types": ["timestamped_narrative_corpus", "new_evidence"],
      "license_note": "Exact publisher publication/update metadata and body digest; only metadata is committed and the research copy remains private."
    },
    {
      "source_id": "exchange-positioning-flow",
      "category": "positioning_or_expectations",
      "provider_id": "tushare-http",
      "source_tier": "regulated",
      "acquisition_mode": "implemented_source_publication_model",
      "point_in_time_authority": true,
      "evidence_types": ["consensus_or_positioning", "participant_belief_or_flow"],
      "license_note": "Private SSE/SZSE margin summaries bind each exchange-date row to the Tushare table hash and documented daily 09:00 update rule."
    },
    {
      "source_id": "issuer-sector-filings",
      "category": "issuer_or_sector_fundamentals",
      "provider_id": "exchange-filing-archive",
      "source_tier": "regulated",
      "acquisition_mode": "planned_archive_capture",
      "point_in_time_authority": false,
      "evidence_types": ["cash_flow_or_earning_power", "fundamental_feedback"],
      "license_note": "Use filing versions visible at each checkpoint; never backfill later restatements silently."
    },
    {
      "source_id": "gdelt-discovery",
      "category": "archive_discovery",
      "provider_id": "gdelt",
      "source_tier": "specialist",
      "acquisition_mode": "discovery_only",
      "point_in_time_authority": false,
      "evidence_types": ["timestamped_narrative_corpus"],
      "license_note": "Discovery aid only; publisher or archive evidence remains required."
    },
    {
      "source_id": "common-crawl-discovery",
      "category": "archive_discovery",
      "provider_id": "common-crawl",
      "source_tier": "specialist",
      "acquisition_mode": "discovery_only",
      "point_in_time_authority": false,
      "evidence_types": ["timestamped_narrative_corpus"],
      "license_note": "Archive locator only until a source version and availability basis are bound."
    }
  ],
  "checkpoint_protocol": {
    "timezone": "Asia/Shanghai",
    "decision_time_local": "09:25:00",
    "price_lookback_sessions": 60,
    "news_lookback_calendar_days": {
      "monthly": 31,
      "weekly": 14,
      "event_then_weekly": 14
    },
    "maximum_age_calendar_days": {
      "official_context": 365,
      "macro_vintage": 120,
      "positioning_or_expectations": 14,
      "issuer_or_sector_fundamentals": 180
    }
  },
  "baseline_protocol": {
    "annualization_sessions": 252,
    "minimum_risk_sessions": 20,
    "risk_free_rate_annual": "0",
    "cvar_confidence": "0.95",
    "transaction_cost_bps_one_way": "10",
    "rebalance_frequency": "monthly_first_session",
    "momentum_lookback_sessions": 20,
    "momentum_top_k": 3,
    "strategies": [
      "cash",
      "primary_buy_and_hold",
      "equal_sector_buy_and_hold",
      "lagged_sector_momentum"
    ]
  },
  "cases": [
    {
      "case_key": "cn-2014-2015-leveraged-melt-up",
      "decision_schedule": "monthly",
      "analysis_needs": ["feedback_loop", "cycle_position", "narrative_diffusion"],
      "candidate_method_skills": ["second-level-cycle-context", "reflexive-feedback-check", "narrative-diffusion-assessment"],
      "query_terms": ["A股 杠杆牛市 融资融券 2014 2015", "China stock leverage rally 2014 2015"],
      "evaluation_horizons": ["near_term_12w", "full_case"],
      "source_requirements": [
        {"category": "market_price", "source_ids": ["tushare-market"], "minimum_records_per_checkpoint": 60, "minimum_distinct_sources": 1, "authenticated_availability_required": true},
        {"category": "industry_price", "source_ids": ["tushare-industry"], "minimum_records_per_checkpoint": 31, "minimum_distinct_sources": 1, "authenticated_availability_required": true},
        {"category": "official_context", "source_ids": ["csrc-official-archive", "state-council-official-archive"], "minimum_records_per_checkpoint": 1, "minimum_distinct_sources": 1, "authenticated_availability_required": true},